<?xml version="1.0" encoding="UTF-8"?>
<!ELEMENT CATEGORY (PRODUCT+)>
<!ELEMENT PRODUCT (PID, PNAME, PDESCRIPTION, PPRICE, PDISCOUNT)>
<!ELEMENT PID (#PCDATA)>
<!ELEMENT PNAME (#PCDATA)>
<!ELEMENT PDESCRIPTION (#PCDATA)>
<!ELEMENT PPRICE (#PCDATA)>
<!ELEMENT PDISCOUNT (#PCDATA)>
