<?xml version="1.0" encoding="UTF-8"?>
<!DOCTYPE CATEGORY SYSTEM "catalog.dtd" >
<CATEGORY>
  <PRODUCT>
    <PID>101</PID>
    <PNAME>AAA</PNAME>
    <PDESCRIPTION>BSFBFDBFDBFD</PDESCRIPTION>
    <PPRICE>222223</PPRICE>
    <PDISCOUNT>10%</PDISCOUNT>
  </PRODUCT>
  <PRODUCT>
    <PID>102</PID>
    <PNAME>AfA</PNAME>
    <PDESCRIPTION>BSFBFDBFggDBFD</PDESCRIPTION>
    <PPRICE>22223</PPRICE>
    <PDISCOUNT>10%</PDISCOUNT>
  </PRODUCT>
</CATEGORY>
